ID,Nome,Endereco,Telefone,Data_de_cadastro,CNPJ,Porte
2475,Alexandre Ferreira Fernandes Rodriguez,AL,41456-9572,18/4/2017,13.178.113/7954-69,EPP
2476,Vanessa Munhoz Saboia Ferraz,ES,67797-3195,24/1/2017,20.901.745/1572-74,Medio Porte
2477,Willian Cabral Diones Diones,PA,63377-2126,16/1/2023,39.716.887/0495-90,ME
2478,Bruno Matos Rodrigues Ferraz,ES,85504-4478,20/5/2017,24.843.933/8729-08,EPP
2479,Marcos Nascimento Ferraz Barbieri,PE,42873-3965,16/8/2022,94.240.233/2400-20,ME
2480,Frida Lobato Fernandes Cardoso,AC,81449-4929,5/6/2021,33.658.387/6256-98,ME
2481,Carlos Ferreira Silva Coutinho,PB,15417-3653,13/7/2025,69.095.132/8223-80,ME
2482,Mafalda Cardoso Coutinho Oliveria,AM,09521-3821,28/3/2019,26.821.250/0843-44,MEI
2483,Bruna Nascimento Ferraz Saboia,SP,41093-1052,11/7/2022,37.713.557/6909-19,ME
2484,Helena Brito Munhoz Mendonça,AP,74931-0758,15/8/2022,31.989.681/4896-65,MEI
2485,Bárbara Teixeira Munhoz Fernandes,PA,34256-3577,6/7/2021,91.434.191/9618-08,EPP
2486,Regina Ferreira Gonçalves Cabral,GO,30661-6089,20/6/2024,17.818.216/3400-82,ME
2487,Sônia Diones Barbieri Rodrigues,SC,09719-9527,13/10/2021,35.678.552/5873-84,MEI
2488,Nara Mendonça Leite Brito,PR,43198-1806,9/12/2017,12.153.660/0007-18,MEI
2489,Cláudio Nascimento Diones Santana,SP,83015-9377,13/4/2024,83.971.360/5809-95,EPP
2490,Gustavo Rodriguez Ferraz Coutinho,RJ,26766-0784,19/7/2019,53.035.658/8916-35,MEI
2491,Victor Matos Boaz Mendonça,CE,59908-3292,6/1/2021,27.764.877/7685-93,MEI
2492,Luisa Pinheiro Rodrigues Leme,MS,11954-4982,10/2/2015,22.551.304/7338-16,ME
2493,Naira Boaz Gonçalves Teixeira,MG,41382-2398,23/3/2015,12.897.446/0203-93,EPP
2494,Isabela Oliveria Santana Brito,RO,84333-0987,25/7/2016,28.356.454/5523-45,Medio Porte
2495,Eloísa Diones Silva Ferraz,MG,14646-4467,20/9/2018,46.539.206/9366-77,ME
2496,Gabriel Ferreira Breda Fernandes,PR,18392-9498,28/9/2019,31.968.990/9734-32,ME
2497,Esther Rodrigues Marques Marques,MS,22300-0123,9/4/2020,32.001.511/7265-27,MEI
2498,Juan Cabral Ferraz Ferraz,GO,55384-0776,13/5/2022,01.249.779/5865-31,Medio Porte
2499,Nara Teixeira Silva Nascimento,AL,57380-3160,4/12/2022,01.236.151/0431-60,EPP
2500,Luisa Silva Boaz Brito,TO,11656-9457,11/1/2019,24.865.919/8912-05,ME
2501,Eduardo Fernandes Ferraz Ferraz,BA,60800-3207,4/6/2015,21.769.434/1253-77,EPP
2502,Luiz Gonçalves Gonçalves Coutinho,AM,90357-9233,25/6/2020,96.421.684/0861-03,ME
2503,Chico Marques Santana Diones,AL,74747-6045,4/10/2015,64.752.222/9890-55,EPP
2504,Louise Matos Lobato Ferraz,RJ,57275-1445,11/2/2023,18.366.002/7254-11,MEI
2505,Patrick Moares Pinheiro Leme,SP,57643-4180,25/7/2023,65.371.041/8314-67,EPP
2506,David Leme Gonçalves Cabral,MS,44951-5500,7/3/2024,23.293.785/6329-37,Grande Porte
2507,Luisa Lobato Silva Barbieri,SC,17424-3941,2/4/2017,25.605.398/8529-40,ME
2508,Milton Cabral Ferraz Matos,AM,55518-3309,1/7/2016,56.014.757/0849-68,MEI
2509,Sônia Ferreira Diones Cabral,PI,98969-4724,18/5/2019,20.005.203/0523-79,Medio Porte
2510,Cassandra Pinheiro Leme Ferraz,SC,37964-6453,24/5/2017,64.247.908/8231-37,ME
2511,Joana Fernandes Saboia Matos,MS,08233-6197,16/2/2019,30.555.360/4982-66,MEI
2512,Alice Marques Nascimento Ferreira,SP,08024-3350,26/12/2023,78.096.050/5702-60,EPP
2513,Marlene Barbieri Barbieri Ferraz,AL,10414-5923,1/6/2017,85.212.959/4211-66,EPP
2514,Clara Teixeira Matos Mendonça,RJ,42972-3108,28/7/2023,86.260.144/0512-02,Grande Porte
2515,Dora Rodrigues Rodrigues Mendonça,GO,50038-4803,15/3/2018,52.250.413/0452-32,MEI
2516,Danilo Moares Nascimento Munhoz,SE,19606-1627,5/10/2016,29.590.664/1666-90,ME
2517,Lucas Ferraz Saboia Saboia,PI,63100-9945,13/10/2018,62.583.105/0858-94,MEI
2518,Patrick Brito Barbieri Brito,RS,78853-6406,7/6/2017,91.810.468/2373-66,ME
2519,Esther Barbieri Ferreira Brito,CE,52165-0572,18/11/2017,28.339.317/4928-47,ME
2520,Gabriel Pinheiro Saboia Oliveria,RO,43781-3398,6/11/2020,19.956.362/3781-14,ME
2521,Josué Moares Silva Silva,SP,01977-7780,26/1/2024,26.677.450/3577-11,EPP
2522,Ana Rodriguez Leite Ferreira,PA,53641-0740,28/4/2017,95.377.009/4883-53,MEI
2523,Caio Gonçalves Coutinho Paz,SE,63321-1885,12/10/2025,07.854.432/0089-98,ME
2524,Samuel Cardoso Breda Leite,RR,14774-6753,27/5/2023,60.933.651/2443-05,MEI
2525,Gabriel Oliveria Rodrigues Ferreira,MS,83326-1561,12/2/2021,07.292.441/0722-38,MEI
2526,Roberto Leite Ferraz Teixeira,RR,38124-9078,18/3/2023,54.035.403/0136-30,EPP
2527,Benjamim Ferraz Boaz Paz,AL,93234-5786,16/5/2018,89.533.018/2126-87,MEI
2528,Martha Saboia Silva Ferraz,PE,19594-0978,1/5/2019,31.739.381/2799-61,EPP
2529,Marlene Mendonça Fernandes Mendonça,RS,69306-3186,9/12/2025,69.207.344/4420-57,MEI
2530,Rodolfo Saboia Fernandes Barbieri,MG,74198-7585,16/6/2015,81.942.114/1326-33,ME
2531,Guilherme Ferraz Pinheiro Paz,AC,57529-7809,20/9/2023,77.366.190/6505-14,ME
2532,Marcelo Ferreira Rodrigues Munhoz,SE,06628-5051,5/10/2019,84.334.527/2523-44,MEI
2533,Camilla Boaz Saboia Rodrigues,DF,35148-9261,4/11/2018,55.647.856/8357-78,EPP
2534,Dalva Ferraz Lobato Leite,GO,36352-0887,12/5/2020,30.534.447/8309-07,Medio Porte
2535,Rita Brito Gonçalves Paz,MA,48136-7530,5/7/2021,37.735.005/4607-53,EPP
2536,Elizabeth Lobato Lobato Barbieri,MT,33628-5866,8/5/2022,50.592.344/5898-41,ME
2537,Bernardo Ferreira Marques Cabral,SC,62508-0413,13/11/2023,83.518.556/2015-82,EPP
2538,Vinícius Ferraz Teixeira Barbieri,PR,91419-7300,14/1/2021,68.076.934/6705-45,EPP
2539,Luisa Fernandes Barbieri Ferraz,MG,83236-8909,16/7/2024,81.184.076/9517-57,ME
2540,Cassandra Leme Santana Breda,PB,05514-8621,2/9/2022,33.190.270/2982-16,ME
2541,Ana Cabral Lobato Saboia,RJ,75169-3752,8/7/2019,59.779.136/5173-81,EPP
2542,Naira Ferraz Gonçalves Marques,MA,32892-1901,6/1/2017,86.045.361/9741-46,EPP
2543,Christina Oliveria Fernandes Santana,AC,56750-3275,19/10/2021,06.071.288/9594-94,Medio Porte
2544,Jason Matos Lobato Rodriguez,RR,69327-0142,17/1/2017,63.518.840/9580-01,ME
2545,Naira Breda Ferraz Pinheiro,ES,03153-4169,7/2/2015,78.077.016/2349-86,ME
2546,Lucas Boaz Coutinho Brito,MG,40474-1111,10/7/2020,57.969.539/4484-16,ME
2547,Joana Ferraz Diones Lobato,RO,29521-5969,22/12/2018,84.309.577/8802-54,MEI
2548,Isabela Diones Brito Mendonça,SE,07739-1200,15/2/2018,06.281.839/4367-75,ME
2549,Jonathan Cardoso Moares Ferraz,GO,08395-1074,28/11/2016,06.762.188/5674-45,MEI
2550,Alexandre Rodrigues Oliveria Leite,MG,66810-9877,21/12/2016,74.087.856/3551-55,ME
2551,Gabriela Gonçalves Nascimento Paz,RN,03039-7949,5/3/2023,60.723.979/6772-63,EPP
2552,Adão Munhoz Cardoso Moares,MA,86006-3595,7/1/2016,33.504.365/4037-29,ME
2553,Ana Munhoz Lobato Pinheiro,PA,77162-2652,4/6/2023,69.116.289/8743-82,ME
2554,Tom Marques Oliveria Matos,TO,01849-7711,26/5/2021,60.049.978/9748-58,ME
2555,Sandra Matos Saboia Boaz,RJ,81097-8676,4/9/2024,02.308.844/3004-12,ME
2556,Suely Silva Saboia Diones,BA,86837-9019,28/8/2021,73.937.766/3054-27,EPP
2557,Bruna Lobato Boaz Boaz,RR,32938-7095,27/6/2017,72.221.330/9824-48,MEI
2558,Adriel Santana Ferraz Gonçalves,AC,07369-5910,6/1/2020,98.417.772/0723-51,EPP
2559,Joana Ferreira Boaz Boaz,MT,55327-1566,25/1/2021,94.557.643/3261-30,ME
2560,Helena Silva Barbieri Ferraz,RR,70522-6199,13/1/2018,78.147.880/0248-83,MEI
2561,Jacques Santana Silva Brito,RS,92217-7539,1/8/2024,40.306.811/1941-04,EPP
2562,Sabrina Leme Mendonça Lobato,SC,98992-3862,2/6/2022,08.046.169/0401-80,EPP
2563,Bruno Leme Breda Rodrigues,AC,34570-3690,14/7/2018,70.370.637/0033-06,ME
2564,Clara Saboia Lobato Paz,PB,50149-2332,19/6/2015,59.452.517/0424-37,ME
2565,Gustavo Rodriguez Ferraz Rodriguez,AL,88892-5288,8/11/2022,45.812.892/6154-37,ME
2566,Sandra Rodrigues Ferraz Boaz,SC,58139-6492,17/7/2019,43.644.888/4017-28,EPP
2567,Emily Marques Fernandes Silva,DF,21349-6904,17/6/2018,63.344.593/7953-58,MEI
2568,Danilo Rodriguez Diones Rodriguez,RN,45461-6406,9/5/2018,15.490.265/0774-47,Medio Porte
2569,Clara Saboia Saboia Saboia,AL,44660-7380,19/8/2017,79.912.946/0425-22,ME
2570,Adão Pinheiro Santana Ferraz,MS,52549-6006,25/6/2025,00.757.317/1143-09,ME
2571,Victor Paz Mendonça Saboia,MS,69203-6102,12/12/2022,98.816.850/3985-97,ME
2572,Elis Brito Santana Silva,CE,87290-3182,16/8/2019,55.959.121/5351-11,Grande Porte
2573,Dora Matos Pinheiro Mendonça,SE,29297-5588,19/7/2021,35.857.128/5030-73,EPP
2574,Zulmira Ferraz Teixeira Diones,MS,36446-5249,13/5/2016,91.256.270/1180-17,MEI
2575,Breno Coutinho Ferreira Santana,ES,41167-8534,20/6/2019,23.857.573/2601-61,EPP
2576,Gustavo Ferreira Fernandes Diones,BA,90732-5761,5/12/2022,70.648.700/8408-32,ME
2577,Elis Paz Ferreira Coutinho,RJ,91735-6740,3/7/2018,88.105.540/2186-88,EPP
2578,Marcelo Ferraz Gonçalves Barbieri,AC,49193-3099,19/4/2018,24.940.590/1994-50,MEI
2579,Breno Oliveria Ferreira Oliveria,AM,81288-1144,9/6/2016,58.592.317/0414-10,ME
2580,Vanessa Pinheiro Teixeira Moares,MG,04484-3688,19/3/2025,95.395.219/4158-44,ME
2581,Clara Coutinho Ferraz Boaz,BA,64455-1599,19/9/2019,88.170.362/4185-57,EPP
2582,Ben Leite Cabral Ferraz,PA,20361-6103,2/6/2021,02.077.140/1871-10,EPP
2583,Gabriel Boaz Fernandes Marques,SP,24896-4321,8/3/2025,97.972.369/2050-69,ME
2584,Joelma Brito Rodrigues Ferraz,AC,80709-5530,25/6/2019,89.804.686/4404-37,ME
2585,Marcelo Brito Nascimento Boaz,GO,79672-2879,5/3/2020,31.343.679/0917-01,ME
2586,Laís Oliveria Gonçalves Gonçalves,TO,66876-3385,26/7/2023,30.430.997/2772-06,ME
2587,Diana Leme Ferreira Mendonça,CE,29937-2429,28/7/2025,69.339.826/2809-58,Medio Porte
2588,Enzo Fernandes Santana Munhoz,MT,56004-4032,2/9/2020,62.468.166/5591-28,EPP
2589,Jorge Ferraz Cabral Diones,RJ,27783-2601,17/2/2020,97.960.223/5326-83,EPP
2590,Sandra Saboia Leite Paz,AP,07328-0717,20/3/2020,53.052.693/7330-66,ME
2591,Alice Ferraz Marques Leme,CE,62209-3759,3/4/2025,88.816.478/4564-91,MEI
2592,Rita Ferraz Nascimento Rodriguez,PE,92389-0606,13/8/2021,12.840.654/0350-67,ME
2593,Carlos Gonçalves Nascimento Munhoz,RS,14705-1304,16/2/2022,88.167.543/8781-75,EPP
2594,Raquel Diones Rodrigues Rodriguez,RO,74282-2071,23/1/2019,94.222.966/5944-27,EPP
2595,Micheal Marques Paz Gonçalves,SE,85013-8545,25/2/2017,43.895.937/1798-93,EPP
2596,Marlon Leite Diones Boaz,SP,60088-1602,9/9/2024,21.152.070/8122-43,EPP
2597,Pedro Nascimento Moares Marques,MT,27633-2072,19/6/2017,60.218.685/0864-36,EPP
2598,Diana Matos Ferraz Cabral,TO,21655-9464,3/8/2017,50.763.876/8001-10,MEI
2599,Vitor Paz Saboia Fernandes,PA,19775-2994,6/9/2017,53.503.451/9441-22,MEI
2600,Laís Leme Coutinho Paz,MA,81375-1629,28/6/2019,64.283.681/8734-68,EPP
2601,Marlene Marques Diones Gonçalves,MT,90945-2570,27/1/2021,66.205.485/6952-37,ME
2602,Benjamim Diones Marques Silva,AP,89557-2272,18/9/2025,90.117.825/5965-05,ME
2603,Gabriela Mendonça Ferraz Rodriguez,MS,67010-0209,6/1/2017,15.675.632/6042-37,ME
2604,Samuel Leite Gonçalves Fernandes,AL,32282-7434,6/7/2025,69.579.536/1669-57,Grande Porte
2605,Frida Fernandes Diones Teixeira,PR,88047-7696,17/2/2025,51.915.712/1371-89,ME
2606,Joelma Nascimento Gonçalves Marques,PB,24869-5547,12/2/2024,68.994.156/6844-68,MEI
2607,Rute Saboia Breda Oliveria,PB,98082-6306,17/1/2017,48.580.551/4766-29,EPP
2608,Giovanni Saboia Teixeira Munhoz,RJ,11068-4905,22/12/2025,74.402.318/3898-11,MEI
2609,Nayara Gonçalves Leme Fernandes,PR,57271-9624,16/5/2018,07.248.753/5494-70,MEI
2610,Rute Moares Breda Brito,RO,38818-0969,11/1/2025,59.872.148/9059-59,Medio Porte
2611,Mateus Fernandes Lobato Brito,ES,60753-8095,16/3/2022,52.094.814/7536-67,EPP
2612,Thiago Barbieri Moares Breda,PE,89763-0520,18/6/2016,95.083.240/0531-70,Medio Porte
2613,Anita Teixeira Diones Diones,DF,28271-7930,17/9/2021,43.105.789/1633-71,EPP
2614,Luisa Cardoso Lobato Ferraz,MG,30417-9384,24/9/2024,19.662.057/1033-27,ME
2615,Breno Teixeira Marques Barbieri,AL,48313-2788,3/9/2024,78.691.423/7173-63,EPP
2616,Ayrton Ferraz Breda Boaz,AC,44232-9419,1/2/2015,59.668.980/8536-83,EPP
2617,Enzo Silva Ferraz Breda,RR,48550-5445,5/10/2016,77.676.382/1329-59,Medio Porte
2618,Willian Rodriguez Coutinho Santana,BA,08412-2576,15/3/2015,22.662.733/3690-23,ME
2619,Elizabeth Boaz Saboia Ferraz,PI,69382-9092,11/10/2018,61.980.340/4424-25,EPP
2620,Marcos Cabral Saboia Ferraz,CE,61734-0641,23/6/2022,15.956.659/7149-60,MEI
2621,Esther Boaz Rodrigues Boaz,RO,10355-6571,25/6/2015,40.071.243/4619-52,Medio Porte
2622,Benjamim Cardoso Boaz Breda,TO,18074-6577,14/8/2021,56.011.208/3358-42,EPP
2623,Rodolfo Diones Pinheiro Breda,RJ,88658-1306,22/1/2015,99.603.365/4581-46,ME
2624,Marcos Paz Marques Leme,PB,92989-6866,5/3/2016,99.071.657/0330-08,ME
2625,Caio Munhoz Breda Breda,PB,65366-7574,25/11/2017,46.753.470/9376-65,Grande Porte
2626,David Paz Diones Santana,PB,45819-0840,24/12/2019,56.603.588/7194-03,ME
2627,Mateus Rodriguez Diones Santana,BA,88764-4340,22/7/2020,31.672.733/4484-06,Medio Porte
2628,Fátima Ferraz Mendonça Ferreira,BA,19574-6097,5/1/2023,67.286.559/0391-86,ME
2629,Miguel Ferreira Ferreira Matos,PA,45153-4007,20/10/2019,80.605.590/0515-52,EPP
2630,Vitor Leite Rodrigues Ferreira,GO,65691-7150,25/11/2021,52.826.577/7463-05,ME
2631,Adriel Matos Teixeira Silva,AC,86997-5648,15/3/2015,46.146.850/2702-15,EPP
2632,Creuza Marques Nascimento Saboia,AP,61441-2855,19/12/2018,04.198.537/0015-79,Medio Porte
2633,Frida Pinheiro Barbieri Marques,RO,75653-9807,5/12/2020,44.282.802/4397-68,ME
2634,Christina Santana Silva Teixeira,PB,08716-2505,19/10/2016,90.674.740/7532-10,ME
2635,Jacques Santana Munhoz Coutinho,BA,13401-2587,15/9/2015,77.768.637/7670-93,Grande Porte
2636,Clara Lobato Boaz Leme,PR,93204-4118,15/4/2021,61.979.955/7168-32,ME
2637,Joana Moares Ferreira Marques,AM,82176-7363,20/10/2025,30.808.264/7767-05,Medio Porte
2638,Frederico Cabral Breda Ferraz,BA,55876-8150,27/5/2024,26.608.542/9417-03,EPP
2639,Laís Coutinho Fernandes Silva,AC,48090-8126,19/4/2019,31.475.895/2993-10,ME
2640,Sônia Cardoso Pinheiro Rodrigues,RN,66875-7829,27/3/2023,52.255.104/0171-97,ME
2641,Patrick Ferreira Matos Munhoz,AL,20018-5799,24/11/2019,31.005.447/6701-37,ME
2642,Anita Moares Cabral Gonçalves,BA,46422-2331,27/11/2021,65.132.854/7519-93,ME
2643,Andréia Diones Oliveria Paz,RR,68781-4176,8/9/2019,48.025.651/9333-38,ME
2644,Frederico Paz Breda Silva,PA,60427-0904,8/6/2023,67.690.206/9777-73,EPP
2645,Gabriela Coutinho Saboia Teixeira,CE,57164-6922,13/5/2023,65.116.302/6194-58,Medio Porte
2646,Cassandra Nascimento Coutinho Coutinho,ES,20665-6872,5/7/2023,12.235.664/5527-54,ME
2647,Vanessa Fernandes Fernandes Leite,PE,81748-2041,12/5/2021,45.884.648/4256-80,MEI
2648,Bruno Barbieri Fernandes Ferraz,RN,69987-2843,22/5/2017,49.523.607/0138-40,ME
2649,Isabel Marques Gonçalves Barbieri,AL,78237-1171,27/2/2017,43.431.733/2761-61,Medio Porte
2650,Anna Cardoso Leme Cardoso,GO,61063-2628,15/1/2017,00.520.229/9722-25,ME
2651,Giuseppe Ferraz Brito Fernandes,ES,72943-5998,2/8/2020,47.138.388/2168-02,EPP
2652,Lorena Cardoso Marques Oliveria,TO,52399-0610,17/10/2021,75.498.580/5448-31,MEI
2653,Emanuel Silva Breda Breda,PI,04564-6759,22/7/2018,11.794.966/9315-94,EPP
2654,Miguel Gonçalves Teixeira Ferreira,PI,58317-9003,25/4/2019,04.466.032/6588-84,ME
2655,Luiz Oliveria Cardoso Rodrigues,PI,62459-5693,4/11/2022,81.779.534/7840-90,ME
2656,Wanda Lobato Diones Breda,SC,22445-2162,21/2/2015,00.412.250/6572-67,MEI
2657,Solange Ferraz Brito Breda,RN,31460-7315,11/6/2018,50.635.577/4791-73,MEI
2658,Pedro Cardoso Coutinho Paz,PI,04610-3857,13/11/2018,15.102.759/9812-47,MEI
2659,Isabel Rodrigues Oliveria Munhoz,SP,57347-8143,19/6/2022,00.103.868/1718-09,ME
2660,André Ferraz Teixeira Cardoso,DF,41716-2128,15/5/2021,27.755.266/2771-16,EPP
2661,Henry Fernandes Brito Ferraz,BA,24066-5094,3/10/2015,60.153.387/8983-06,EPP
2662,Palmira Breda Oliveria Lobato,MA,45700-6352,17/11/2022,74.544.309/8250-85,ME
2663,Carol Diones Breda Barbieri,RR,97895-7184,27/11/2017,17.949.703/4405-17,Medio Porte
2664,Rodolfo Ferraz Moares Saboia,SE,14554-9179,20/4/2023,24.379.366/8654-43,ME
2665,Laís Ferreira Mendonça Leme,DF,00244-7627,20/9/2019,87.929.777/8491-59,MEI
2666,Ana Saboia Paz Barbieri,AP,37506-6277,24/2/2020,22.559.043/7033-86,MEI
2667,Dorotéia Saboia Leme Ferraz,PB,23031-3046,17/9/2017,34.234.944/0299-79,ME
2668,Abraão Barbieri Leme Leite,MG,28840-4018,1/7/2024,04.081.848/5132-55,MEI
2669,Lorena Santana Santana Coutinho,AC,13573-9578,13/7/2016,12.700.708/0153-00,ME
2670,Micheal Ferraz Leite Rodrigues,AM,14967-5545,7/12/2018,33.054.521/2275-84,ME
2671,Breno Silva Fernandes Cabral,CE,22347-7319,2/7/2018,25.526.576/7441-73,ME
2672,Antonieta Moares Paz Oliveria,PI,13062-9339,20/8/2017,24.479.137/2385-16,Medio Porte
2673,Helena Lobato Brito Brito,PI,89773-1440,3/10/2021,02.333.262/2131-57,ME
2674,Jonas Rodrigues Fernandes Fernandes,PA,32001-4660,5/6/2024,58.788.615/4511-01,ME
2675,Miguel Diones Silva Marques,BA,65233-5449,16/4/2016,21.048.422/7365-81,Medio Porte
2676,Christina Cardoso Rodrigues Marques,AP,64704-5055,13/11/2016,58.602.874/8624-18,MEI
2677,Camilla Marques Cardoso Santana,AP,13477-9355,19/11/2025,57.917.017/0879-97,ME
2678,Suzana Coutinho Teixeira Rodriguez,AL,39729-3878,20/4/2015,47.205.078/1329-40,EPP
2679,Antonieta Moares Teixeira Silva,PR,22583-5850,1/1/2020,28.627.599/6021-08,EPP
2680,Solange Silva Rodrigues Coutinho,SC,29601-4147,12/8/2015,89.606.889/6538-42,EPP
2681,Danilo Saboia Marques Saboia,PB,59842-6201,17/11/2020,63.648.801/4090-97,ME
2682,Jason Diones Brito Ferreira,SE,55477-1453,17/10/2019,66.317.099/7824-95,ME
2683,Rute Pinheiro Ferraz Boaz,BA,47764-0051,20/3/2021,54.109.086/5252-38,EPP
2684,Ayrton Brito Barbieri Nascimento,SC,88212-0735,24/1/2024,89.349.739/8083-18,MEI
2685,Rafael Ferraz Lobato Oliveria,PR,58921-0447,26/8/2024,45.329.612/6148-05,EPP
2686,Gabriel Coutinho Teixeira Cabral,RN,54847-3525,12/4/2020,56.980.260/4849-54,ME
2687,Suzana Ferreira Ferraz Diones,PE,39994-6602,1/3/2021,54.077.923/6383-77,ME
2688,Adão Saboia Diones Oliveria,GO,42761-2850,28/6/2015,13.450.049/1762-13,ME
2689,Jonas Marques Ferraz Barbieri,TO,30778-4871,13/3/2019,99.921.565/7301-02,ME
2690,Rute Breda Leme Marques,RN,48763-1702,3/9/2017,61.353.861/6456-83,ME
2691,Creuza Fernandes Ferraz Pinheiro,RJ,97845-4949,13/5/2019,34.272.925/0501-41,MEI
2692,Jorge Pinheiro Oliveria Santana,CE,91718-4059,1/12/2020,37.467.083/9106-96,ME
2693,Christina Nascimento Ferraz Breda,SP,92308-1785,14/11/2020,14.618.035/7606-83,ME
2694,Jason Paz Lobato Matos,RO,30628-5380,10/8/2019,90.520.123/8436-94,ME
2695,Jorge Silva Marques Teixeira,PB,09609-3048,22/8/2025,91.724.623/1140-04,EPP
2696,Vitor Pinheiro Nascimento Diones,MA,56294-2228,10/12/2018,61.500.892/5666-06,EPP
2697,Joana Teixeira Leme Coutinho,ES,64661-0731,19/3/2019,91.558.103/9499-58,EPP
2698,Luiz Rodrigues Breda Fernandes,ES,61285-0003,5/11/2024,05.181.701/9767-21,ME
2699,Dora Marques Ferraz Saboia,AC,77933-5434,19/7/2023,99.663.109/3407-45,MEI
2700,Mercedes Fernandes Nascimento Leite,RR,41383-3046,22/6/2024,48.537.396/8059-31,MEI
2701,Davi Saboia Diones Diones,PR,05224-1833,16/8/2020,08.297.849/0940-02,Medio Porte
2702,Mercedes Ferreira Santana Marques,TO,46011-4400,17/10/2015,10.134.002/9754-12,ME
2703,Regina Marques Breda Ferraz,AP,39880-8678,10/1/2020,48.190.931/6146-84,ME
2704,Willian Rodrigues Leme Diones,RO,68063-7797,4/8/2019,28.466.402/1943-51,ME
2705,Arthur Mendonça Cabral Moares,PI,15899-2381,28/10/2024,54.933.028/4018-10,Medio Porte
2706,Thiago Ferraz Gonçalves Santana,RJ,12600-4580,5/10/2024,23.264.114/9875-29,Medio Porte
2707,Milton Rodriguez Ferreira Paz,GO,03466-0649,21/8/2022,71.229.408/0060-45,EPP
2708,Eloísa Silva Gonçalves Moares,AM,16699-7448,6/5/2015,48.042.123/0711-73,MEI
2709,Breno Boaz Barbieri Rodrigues,TO,89255-3150,3/1/2024,68.319.008/8879-66,Grande Porte
2710,Rita Moares Cardoso Lobato,AP,93910-8311,14/8/2019,47.469.321/6463-46,ME
2711,David Nascimento Ferraz Teixeira,PE,87739-3627,6/10/2015,19.279.685/1072-76,ME
2712,Micheal Teixeira Santana Lobato,AM,00991-8537,2/10/2015,87.635.615/4932-91,ME
2713,Tom Breda Silva Teixeira,TO,41917-7706,3/4/2025,96.583.569/3878-29,ME
2714,Patrick Munhoz Coutinho Teixeira,CE,20592-7267,20/7/2021,02.811.920/2846-30,EPP
2715,Daniel Ferraz Brito Mendonça,MA,29818-0515,1/2/2022,02.497.388/9761-57,ME
2716,João Boaz Oliveria Gonçalves,ES,64044-5885,6/6/2022,65.045.203/3578-29,EPP
2717,Antonieta Cardoso Fernandes Rodriguez,RN,27211-1425,24/6/2021,25.191.847/3618-52,Medio Porte
2718,Suzana Fernandes Nascimento Munhoz,TO,12935-4491,1/3/2018,52.865.233/3850-23,ME
2719,Ariel Silva Teixeira Munhoz,DF,79713-9104,16/11/2024,79.923.396/7268-20,EPP
2720,Rita Rodriguez Mendonça Paz,RR,31668-9803,9/1/2017,19.936.558/2899-26,Medio Porte
2721,Ayrton Matos Matos Pinheiro,RS,85162-0041,15/7/2017,22.417.182/5157-02,ME
2722,Marlon Brito Ferreira Breda,MT,85787-8812,24/5/2017,26.730.460/9345-30,ME
2723,Darwim Teixeira Paz Munhoz,PR,58452-6845,27/1/2015,53.929.461/8481-25,EPP
2724,Joelma Rodriguez Munhoz Pinheiro,PR,19479-3013,5/5/2022,48.317.768/7182-39,MEI
2725,Bernardo Silva Lobato Diones,PR,53183-0372,23/8/2019,82.603.796/1987-07,EPP
2726,Ben Coutinho Matos Rodrigues,SC,80357-6927,18/7/2017,40.303.116/5250-53,EPP
2727,Sandra Breda Matos Silva,MG,87557-9637,7/8/2022,65.553.886/4501-25,EPP
2728,Nara Lobato Moares Marques,AC,55992-3109,26/7/2024,19.764.904/4592-32,MEI
2729,Dora Marques Paz Oliveria,PE,30848-5020,24/8/2023,70.973.236/3544-51,MEI
2730,Regina Nascimento Coutinho Ferraz,MG,16448-6020,11/8/2024,04.706.939/5636-59,ME
2731,Miguel Ferraz Coutinho Moares,AM,91716-8535,25/12/2023,24.307.023/6799-13,Medio Porte
2732,Carmem Leite Brito Marques,RN,79584-0779,3/3/2022,21.505.348/6636-10,ME
2733,Antônio Pinheiro Lobato Gonçalves,MA,36888-6889,12/6/2020,31.784.589/2195-00,ME
2734,Felipe Ferraz Paz Barbieri,MA,26686-8525,18/5/2023,72.634.443/2607-20,EPP
2735,Patrick Paz Pinheiro Cabral,MT,13894-4479,11/12/2018,57.850.678/7954-98,ME
2736,David Gonçalves Pinheiro Teixeira,TO,43857-7561,19/7/2020,23.521.859/2582-01,MEI
2737,Davi Leite Gonçalves Fernandes,SE,82563-7035,2/6/2024,13.244.321/8725-71,EPP
2738,Manoel Ferreira Breda Leme,AP,53570-9902,28/9/2021,51.262.851/4318-98,MEI
2739,Tom Rodrigues Brito Matos,AL,87805-9495,23/11/2019,04.396.610/0135-15,MEI
2740,Diana Fernandes Pinheiro Munhoz,RO,25650-0764,25/11/2024,10.998.567/2064-33,MEI
2741,Milton Moares Coutinho Teixeira,AC,34593-4003,4/12/2016,00.741.541/7346-48,MEI
2742,Eduardo Silva Lobato Cardoso,RO,15459-9050,25/6/2025,08.764.425/2911-14,ME
2743,Luiz Lobato Saboia Munhoz,SE,63353-6436,12/7/2018,72.881.459/8464-53,ME
2744,Marcelo Diones Teixeira Coutinho,MT,50013-6690,17/4/2025,90.611.884/2723-55,ME
2745,João Leite Santana Nascimento,SP,61960-0212,4/8/2016,82.605.249/7462-54,MEI
2746,Rodolfo Nascimento Santana Santana,AL,24679-5486,10/11/2020,31.493.726/7926-53,EPP
2747,Mateus Coutinho Mendonça Barbieri,ES,09405-2129,6/9/2024,91.871.336/4829-64,ME
2748,Manoel Leme Boaz Ferreira,RR,02024-9986,7/10/2020,96.853.877/8611-50,EPP
2749,Frida Marques Marques Mendonça,AC,36349-8988,25/3/2019,25.190.749/6351-35,ME
2750,Breno Marques Santana Diones,PI,31589-6978,22/4/2017,99.587.362/3263-33,MEI
2751,Cassandra Moares Saboia Ferraz,RJ,27401-8458,24/2/2024,30.793.028/6489-61,EPP
2752,Breno Marques Fernandes Silva,RR,52296-5289,3/10/2025,22.376.647/6991-75,ME
2753,Bruna Pinheiro Teixeira Paz,DF,41918-9644,10/4/2021,99.091.344/4877-06,MEI
2754,Abraão Boaz Fernandes Munhoz,PA,88790-3252,1/9/2015,56.724.013/5966-64,ME
2755,Louise Breda Nascimento Boaz,SC,87725-7897,16/9/2016,82.423.249/6114-93,EPP
2756,Frederico Ferraz Leite Nascimento,ES,36624-0117,1/1/2024,34.057.840/2473-13,ME
2757,Regina Cardoso Moares Silva,RS,12554-8006,15/5/2016,49.265.413/4087-33,ME
2758,Clara Rodrigues Diones Teixeira,BA,51248-3710,5/7/2019,06.596.839/6077-28,Grande Porte
2759,Vitor Ferreira Moares Cardoso,RJ,32673-3302,5/4/2025,96.577.293/1770-05,MEI
2760,Carla Marques Ferraz Pinheiro,MG,30286-9892,19/1/2025,49.414.794/0645-15,EPP
2761,Diana Cabral Brito Teixeira,PB,07281-1485,25/3/2017,88.108.714/5543-83,ME
2762,Nara Silva Lobato Coutinho,MS,47826-3359,26/10/2024,10.015.666/4006-57,EPP
2763,Mafalda Matos Oliveria Breda,MA,81540-7552,26/4/2025,21.636.047/2904-81,ME
2764,Mafalda Rodrigues Fernandes Moares,RN,44060-5032,19/3/2021,69.257.175/6501-85,EPP
2765,Alice Rodriguez Brito Marques,ES,16282-4813,16/1/2024,04.179.254/4931-47,EPP
2766,Vitor Rodriguez Ferreira Rodrigues,ES,81373-1148,9/1/2019,89.424.057/1260-03,EPP
2767,Isabela Ferraz Gonçalves Breda,PB,97901-5114,7/11/2018,79.047.280/3284-62,EPP
2768,Thomas Barbieri Matos Moares,RO,17504-5904,3/6/2023,99.120.730/9126-09,ME
2769,Esther Coutinho Ferraz Ferraz,PE,49913-0299,11/11/2020,53.788.095/1775-32,EPP
2770,Luiz Cardoso Santana Lobato,DF,02156-1348,26/5/2020,85.127.994/0961-38,EPP
2771,Suely Lobato Pinheiro Santana,DF,79570-8105,3/11/2017,79.411.815/1527-22,ME
2772,Clara Brito Munhoz Rodriguez,PE,96392-6707,9/3/2024,84.720.018/0469-56,EPP
2773,Luiza Silva Nascimento Matos,GO,76045-0680,18/5/2024,24.542.614/4548-74,MEI
2774,Dalva Nascimento Matos Gonçalves,AM,53303-7426,18/6/2025,04.692.891/5035-84,Medio Porte
2775,Henry Oliveria Gonçalves Pinheiro,PR,64360-5570,5/6/2024,91.082.005/6116-27,ME
2776,Bruno Coutinho Rodrigues Gonçalves,RO,63707-5989,16/6/2025,39.248.083/7624-66,EPP
2777,André Ferreira Teixeira Marques,AM,75483-5910,26/6/2015,02.207.779/3231-76,ME
2778,Giuseppe Gonçalves Diones Moares,AL,24481-8725,15/2/2015,56.803.584/5850-52,EPP
2779,Bárbara Gonçalves Cardoso Lobato,MG,47909-6510,27/5/2016,93.994.026/5430-03,EPP
2780,Solange Ferraz Marques Nascimento,PI,00793-8974,4/7/2017,09.082.829/1880-84,EPP
2781,Darwim Ferreira Marques Rodriguez,SP,80215-0012,11/2/2015,83.549.349/2455-29,EPP
2782,Laura Marques Matos Munhoz,SC,52995-0097,8/3/2016,36.421.402/1791-35,EPP
2783,Solange Rodriguez Gonçalves Paz,RR,98008-4234,28/9/2018,03.080.358/3776-96,ME
